,Insulin Given during Admission,Cardiology,May-13,,,,Insulin administered intravenously or subcutaneously during admission?,,Alphanumeric,3 characters,Select from a shortlist,"01 = Yes, 02 = No",NCVD-ACS
intent_of_surgery,Intent of Surgery,Radiotherapy & Oncology,May-13,,,,The rationale or intent for performing a surgical procedure on a patient,,Alphanumeric,,"Select from a shortlist, type in",Refer to lookup table Intent of Surgery,
palliative_treatment,Intent of Treatment for Cancer,Radiotherapy & Oncology,May-13,,,Tujuan rawatan untuk kanser,Intention of cancer treatment which is either curative or palliative,,Alphanumeric,,Select from a shortlist,Refer to lookup table Palliative Treatment,
interferon_gamma_release_assay,Interferon Gamma Release Assay Result,Dermatology,May-13,,,,The result of interferon gamma release assay test,,Alphanumeric,20 characters,,Refer to lookup table Interferon Gamma Release Assay,
intracoronary_devices_used,Intracoronary Devices Used,Cardiology,May-13,,,,Different types of devices used in PCI,,Alphanumeric,,Select from a shortlist,Refer to lookup table Intracoronary Devices Used,NCVD-PCI
,Intra-ocular Lens (IOL),Ophthalmology,May-13,,,,Artificial lens used to replace cataractous lens,,Alphanumeric,,,,
intraop_complication,Intraop Complication,Ophthalmology,May-13,,,,Denotes any complication sustained during ophthalmic surgery,,Alphanumeric,,,Refer to lookup table Intraop Complication,
,Intrapartum Antibiotics,MNNR,May-13,,,,"Antibiotic treatment is provided to the mother within the period mother is in labour, with the intent of preventing infection of the foetus. This includes the prophylactic use of parenteral penicillin or ampicillin",,Alphanumeric,3 characters,Select from a shortlist,"01 = Yes, 02 = No","MNNR, ANZ Neonatal Network Data Dictionary"
,Intrauterine Growth Restriction,NOR,May-13,,IUGR,,"A condition of the fetus in which it fails to reach its genetically predetermined full growth potential due to intrinsic or extrinsic factors, and is based on more than one obstetric ultrasound",,,,,,"NOR, MNNR"
,Iodine Uptake Blockage Compound/Medication,Nuclear Medicine,Sep-12,,,,Compound or drugs capable of blocking radioiodine uptake by the thyroid gland,,Numeric,2 characters,,,
,IUD,NOR,May-13,,Intrauterine death,,Death of fetus after 22 completed weeks in utero before delivery,,,,,,NOR
,IVUS Guided,Cardiology,May-13,,,,Use of intravascular ultrasound in PCI,,Alphanumeric,3 characters,Select from a shortlist,"01 = Yes, 02 = No",NCVD-PCI
,Joint Pain Score,Dermatology,May-13,,,,Scoring of the joint pain using the visual analogue score of 1-10,,Numeric,2 characters,,,
killip_classification,Killip Classification,Cardiology,May-13,,,,"Identifies the Killip class, as a measure of haemodynamics compromise, of the person at the time of presentation. Defines TIMI STEMI score",,Alphanumeric,2 characters,Select from a shortlist,Refer to lookup table Killip Classification,NCVD-ACS NCVD-PCI
label_cautionary,Label Cautionary,Pharmacy,Sep-12,,,Label amaran,Label cautionary,,Alphanumeric,60 characters,,Refer to lookup table Label Cautionary,PhIS
label_instructions,Label Instructions & Special Instruction,Pharmacy,Sep-12,,,Label arahan,Label instructions & special instruction,,Alphanumeric,60 characters,,Refer to lookup table Label Instructions,PhIS
,Laboratory Investigation for Thyroid Disease,Nuclear Medicine,Sep-12,,,,A specific group of laboratory investigations performed on patients with thyroid disease,,Numeric,2 characters,,,
,Laboratory Test Name,Hospital Discharge,Dec-05,,Investigation,Nama ujian makmal,Name of laboratory tests ordered,,Alphanumeric,80 characters,,Refer LOINC,LOINC for lab orders
,Laboratory Test Result,Hospital Discharge,Dec-05,,,Keputusan ujian makmal,Results of the lab test as reported,,Alphanumeric,1000 characters,,,
,Labour Details,NOR,May-13,,,,"It describes the onset and the progress of labour such as sponateous onset, methods of induction and methods of augmentation of labour",,,,,,NOR
,Late Onset Sepsis,MNNR,May-13,,,,Confirmed sepsis at onset at more than 72 hours,,Alphanumeric,3 characters,Select from a shortlist,"01 = Yes, 02 = No",MNNR
,Late Radiation Morbidity Scoring,Radiotherapy & Oncology,May-13,,,Skor kesan jangka panjang morbiditi radiasi,Scoring system to grade late/long term morbidity post radiotherapy treatment,,Alphanumeric,,,,RTOG
rtog1_grade_bladder,Late Radiation Morbidity Scoring - Bladder,Radiotherapy & Oncology,May-13,,,,Scoring system to grade late/long term morbidity post radiotherapy treatment for bladder,,Alphanumeric,,Select from a shortlist,Refer to lookup table Late Radiation Morbidity Scoring (RTOG Grade) - Bladder,
rtog1_grade_bone,Late Radiation Morbidity Scoring - Bone,Radiotherapy & Oncology,May-13,,,,Scoring system to grade late/long term morbidity post radiotherapy treatment for bone,,Alphanumeric,,Select from a shortlist,Refer to lookup table Late Radiation Morbidity Scoring (RTOG Grade) - Bone,
rtog1_grade_brain,Late Radiation Morbidity Scoring - Brain,Radiotherapy & Oncology,May-13,,,,Scoring system to grade late/long term morbidity post radiotherapy treatment for brain,,Alphanumeric,,Select from a shortlist,Refer to lookup table Late Radiation Morbidity Scoring (RTOG Grade) - Brain,
rtog1_grade_eye,Late Radiation Morbidity Scoring - Eye,Radiotherapy & Oncology,May-13,,,,Scoring system to grade late/long term morbidity post radiotherapy treatment for eye,,Alphanumeric,,Select from a shortlist,Refer to lookup table Late Radiation Morbidity Scoring (RTOG Grade) - Eye,
rtog1_grade_heart,Late Radiation Morbidity Scoring - Heart,Radiotherapy & Oncology,May-13,,,,Scoring system to grade late/long term morbidity post radiotherapy treatment for heart,,Alphanumeric,,Select from a shortlist,Refer to lookup table Late Radiation Morbidity Scoring (RTOG Grade) - Heart,
rtog1_grade_joint,Late Radiation Morbidity Scoring - Joint,Radiotherapy & Oncology,May-13,,,,Scoring system to grade late/long term morbidity post radiotherapy treatment for joint,,Alphanumeric,,Select from a shortlist,Refer to lookup table Late Radiation Morbidity Scoring (RTOG Grade) - Joint,
rtog1_grade_kidney,Late Radiation Morbidity Scoring - Kidney,Radiotherapy & Oncology,May-13,,,,Scoring system to grade late/long term morbidity post radiotherapy treatment for kidney,,Alphanumeric,,Select from a shortlist,Refer to lookup table Late Radiation Morbidity Scoring (RTOG Grade) - Kidney,
rtog1_grade_larynx,Late Radiation Morbidity Scoring - Larynx,Radiotherapy & Oncology,May-13,,,,Scoring system to grade late/long term morbidity post radiotherapy treatment for larynx,,Alphanumeric,,Select from a shortlist,Refer to lookup table Late Radiation Morbidity Scoring (RTOG Grade) - Larynx,
rtog1_grade_liver,Late Radiation Morbidity Scoring - Liver,Radiotherapy & Oncology,May-13,,,,Scoring system to grade late/long term morbidity post radiotherapy treatment for liver,,Alphanumeric,,Select from a shortlist,Refer to lookup table Late Radiation Morbidity Scoring (RTOG Grade) - Liver,
rtog1_grade_lung,Late Radiation Morbidity Scoring - Lung,Radiotherapy & Oncology,May-13,,,,Scoring system to grade late/long term morbidity post radiotherapy treatment for lung,,Alphanumeric,,Select from a shortlist,Refer to lookup table Late Radiation Morbidity Scoring (RTOG Grade) - Lung,
rtog1_grade_mucous_membrane,Late Radiation Morbidity Scoring - Mucous Membrane,Radiotherapy & Oncology,May-13,,,,Scoring system to grade late/long term morbidity post radiotherapy treatment for mucous membrane,,Alphanumeric,,Select from a shortlist,Refer to lookup table Late Radiation Morbidity Scoring (RTOG Grade) - Mucous Membrane,
rtog1_grade_oesophagus,Late Radiation Morbidity Scoring - Oesophagus,Radiotherapy & Oncology,May-13,,,,Scoring system to grade late/long term morbidity post radiotherapy treatment for oesophagus,,Alphanumeric,,Select from a shortlist,Refer to lookup table Late Radiation Morbidity Scoring (RTOG Grade) - Oesophagus,
rtog1_grade_salivary_gland,Late Radiation Morbidity Scoring - Salivary Gland,Radiotherapy & Oncology,May-13,,,,Scoring system to grade late/long term morbidity post radiotherapy treatment for salivary gland,,Alphanumeric,,Select from a shortlist,Refer to lookup table Late Radiation Morbidity Scoring (RTOG Grade) - Salivary Gland,
rtog1_grade_skin,Late Radiation Morbidity Scoring - Skin,Radiotherapy & Oncology,May-13,,,,Scoring system to grade late/long term morbidity post radiotherapy treatment for skin,,Alphanumeric,,Select from a shortlist,Refer to lookup table Late Radiation Morbidity Scoring (RTOG Grade) - Skin,
rtog1_grade_small_large_intestine,Late Radiation Morbidity Scoring - Small/Large Intestine,Radiotherapy & Oncology,May-13,,,,Scoring system to grade late/long term morbidity post radiotherapy treatment for small intestine and large intestine,,Alphanumeric,,Select from a shortlist,Refer to lookup table Late Radiation Morbidity Scoring (RTOG Grade) - Small/Large Intestine,
rtog1_grade_spinal_cord,Late Radiation Morbidity Scoring - Spinal Cord,Radiotherapy & Oncology,May-13,,,,Scoring system to grade late/long term morbidity post radiotherapy treatment for spinal cord,,Alphanumeric,,Select from a shortlist,Refer to lookup table Late Radiation Morbidity Scoring (RTOG Grade) - Spinal Cord,
rtog1_grade_subcutaneous_tissue,Late Radiation Morbidity Scoring - Subcutaneous Tissue,Radiotherapy & Oncology,May-13,,,,Scoring system to grade late/long term morbidity post radiotherapy treatment for subcutaneous tissue,,Alphanumeric,,Select from a shortlist,Refer to lookup table Late Radiation Morbidity Scoring (RTOG Grade) - Subcutaneous Tissue,
,LDL-C,Cardiology,May-13,,,,The person’s measured low-density lipoprotein cholesterol (LDL-C) most level before event (in mmol/L),,Numeric,,,,NCVD-ACS NCVD-PCI
left_main_stem_intervention,Left Main Stem Intervention,Cardiology,May-13,,,,Indicate type of PCI performed at LMS,,Alphanumeric,,Select from a shortlist,Refer to lookup table Left Main Stem Intervention,NCVD-PCI
,Length of Stay,Neurology,May-13,,,,The length of time (in days) the patient was admitted for. This data item will be derived from Date of Admission and Date of Discharge,,Numeric,,,,
,Lesion Code,Cardiology,May-13,,,,Indicate the sites of lesion treated by PCI,,Numeric,,,,NCVD-PCI
lesion_description,Lesion Description,Cardiology,May-13,,,,Describes the site and characteristic of lesions,,Alphanumeric,,Select from a shortlist,Refer to lookup table Lesion Description,NCVD-PCI
lesion_result,Lesion Result,Cardiology,May-13,,,,Indicate for the treated lesion whether the treatment was successful or unsuccessful,,Alphanumeric,,Select from a shortlist,Refer to lookup table Lesion Result,NCVD-PCI
lesion_type,Lesion Type,Cardiology,May-13,,,,The lesion type according to ACC/AHA guidelines that determines the complexity of the lesions thus determining the success rate and complication rates following PCI,,Alphanumeric,,Select from a shortlist,Refer to lookup table Lesion Type,NCVD-PCI
living_arrangement,Living Arrangement,Mental Health/Psychiatric,Sep-12,,,,Variable that collects the familial and non-familial relationships of a person to all the other people with whom they usually reside,,Alphanumeric,,Select from a shortlist,Refer to lookup table Living Arrangement,
,LMWH,Cardiology,May-13,,,,Indicate if Low Molecular Weight Heparin medication was given to the patient,,Alphanumeric,3 characters,Select from a shortlist,"01 = Yes, 02 = No",NCVD-ACS NCVD-PCI
,LMWH Given during Admission,Cardiology,May-13,,,,Low Molecular Weight Heparin administered during admission?,,Alphanumeric,3 characters,Select from a shortlist,"01 = Yes, 02 = No",NCVD-ACS
location_graft,Location in Graft,Cardiology,May-13,,,,"Where a graft PCI is being undertaken, it indicates the location of the lesion within the graft",,Alphanumeric,,Select from a shortlist,Refer to lookup table Location in Graft,NCVD-PCI
,Location Name,"Hospital Discharge, Cancer, Mental Health/Psychiatric",Mar-03,,,Nama jalan,House number and street name as per NRIC or as stated by the individual,,Alphanumeric,150 characters,,NA,Public Sector Data Dictionary (PSDD)
,Location of Admission,Neurology,May-13,,,,Location of patient at the time of admission,,Alphanumeric,20 characters,,,
location_death,Location of Death,Cardiology,May-13,,,,The location at which the patient expired,,Alphanumeric,,Select from a shortlist,Refer to lookup table Location of Death,NCVD-PCI
location_lms,Location of LMS,Cardiology,May-13,,,,Site of lesion in LMS,,Alphanumeric,,Select from a shortlist,Refer to lookup table Location of LMS,NCVD-PCI
,Loss of Radial Pulse,Cardiology,May-13,,,,"Indicate whether an acute loss of the pulse radial to the arterial access site occurred either by dissection, thrombus or distal embolization",,Alphanumeric,3 characters,Select from a shortlist,"01 = Yes, 02 = No",NCVD-PCI
,Lost to Follow-up,Radiotherapy & Oncology,May-13,,,Tidak menepati temujanji atau tidak dapat dihubungi,Patient who fail to turn up for clinic appointment or not reachable/contactable at the point of follow up due date,,Alphanumeric,3 characters,Select from a shortlist,"01 = Yes, 02 = No",
,LSCS,NOR,May-13,,Lower segment caesarean section,,An incision made in the lower segment of the uterus to deliver the baby,,,,,,NOR
lymphocytic_infiltrate_peritumoral_lymphoid_aggregates_colorectal_cancer,Lymphocytic Infiltrate -Peritumoral Lymphoid Aggregates in Colorectal Cancer,Colorectal Cancer,May-13,,,Penerapan sel-sel lymphoid di sekitar tumor dalam kanser kolorektal,The aggregation of lymphoid cells surrounding the tumour in colorectal cancer,,Alphanumeric,,,Refer to lookup table Lymphocytic Infiltrate -Peritumoral Lymphoid Aggregates in Colorectal Cancer,
lymphovascular_infiltration_colorectal_cancer_angiolymphatic_invasion,Lymphovascular Infiltration in Colorectal Cancer Angiolymphatic Invasion,Colorectal Cancer,May-13,,,Penerapan kanser ke dalam sistem limfa dan salur darah dalam kanser kolorektal,Assessment of infiltration of cancer cells into the lymphatic and vascular flow- Angiolymphatic Invasion,,Alphanumeric,,,Refer to lookup table Lymphovascular Infiltration in Colorectal Cancer - Angiolymphatic Invasion,
lymphovascular_infiltration_colorectal_cancer_venous_extramural_invasion,Lymphovascular Infiltration in Colorectal Cancer - Venous (Extramural) Invasion,Colorectal Cancer,May-13,,,Penerapan kanser ke dalam sistem limfa dan salur darah dalam kanser kolorektal,Assessment of infiltration of cancer cells into the lymphatic and vascular flow - Venous (Extramural) Invasion,,Alphanumeric,,,Refer to lookup table Lymphovascular Infiltration in Colorectal Cancer - Venous (Extramural) Invasion,
m_staging_pathology_colorectal_cancer,M Pathology Staging in Colorectal Cancer,Colorectal Cancer,May-13,,,Pengelasan patologi M dalam kanser kolorektal,The level of metastasis in colorectal cancer if present,,Alphanumeric,,,Refer to lookup table M Staging in Pathology of Colorectal Cancer,
,Macerated Stillbirth,NOR,May-13,,,,"Intrauterine death of a fetus sometime before the onset of labor, where the fetus showed degenerative changes",,,,,,NOR
major_congenital_anomalies,Major Congenital Anomalies,Obstetric,Oct-06,,,Kecacatan kelahiran major,"A major congenital abnormality is defined as any abnormality of prenatal origin that if uncorrected or uncorrectable, significantly impairs normal physical or social function or reduce normal life expectancy",,Alphanumeric,,,Refer to lookup table Major Congenital Anomalies,MNNR CRF 2012
major_congenital_anomalies_metadata,Major Congenital Anomalies (Meta Data),"Neonatology, MNNR, NOR",May-13,,,,A major congenital abnormality is defined as any abnormality of prenatal origin that if uncorrected or uncorrectable significantly impairs normal physical or social functions or reduce normal life expectancy,,Alphanumeric,3 characters,Select from a shortlist,Refer to lookup table Major Congenital Anomalies,MNNR
manner_of_death,Manner of Death,Forensic,Sep-12,,,Cara kematian,Circumstances surrounding the death,,Alphanumeric,,,Refer to lookup table Manner of Death,
,Mantoux Test Result,Dermatology,May-13,,,,Mantoux test reading in mm 3 days after the test,,Numeric,2 characters,,,
marital_status,Marital Status,"Person Record, Radiotherapy & Oncology, Forensic, Mental",Mar-03,Apr-12,Matrimonial status,Taraf perkahwinan,Matrimonial status of an individual,,Alphanumeric,15 characters,,Refer to lookup table Marital Status,Updated version PUBLIC SECTOR DATA DICTIONARY (PSDD)
material_of_iol,Material of IOL,Ophthalmology,May-13,,,,Substance constituting the IOL,,Alphanumeric,,,Refer to lookup table Material of IOL,
,Maternal Age,"MNNR, NOR",May-13,,,,Age in completed years of the woman giving birth on the date of the baby’s birth,,Numeric,2 characters,,,ANZNN
,Maternal Collapse,NOR,May-13,,,,"An acute event involving the cardio respiratory system and /or brain, resulting in reduced or absent conscious level and potential death at any stage in pregnancy and up to six weeks after delivery",,,,,,NOR
maternal_indication_intervention,Maternal Indication for Intervention,Obstetric,Oct-06,Apr-12,Maternal delivery indication,Indikasi intervensi bagi ibu mengandung,"The medical or obstetric condition of the mother indicating obstetric intervention. Intervention: process of action taken to expedite progress of labour, delivery and other obstetric procedures",,Alphanumeric,,,Refer to lookup table Maternal Indication for Intervention,NOR
maternal_screening_test,Maternal Screening Test,Obstetric,Apr-12,,,,Standard antenatal blood screening test done during current pregnancy,,Alphanumeric,,,Refer to lookup table Maternal Screening Test,MoH
,Maximum Balloon Size Used,Cardiology,May-13,,,,"For the treated lesion, indicate the maximum balloon diameter size used during the PCI (mm)",,Numeric,2 characters,,,NCVD-PCI
,Maximum Stent/Balloon Deploy Pressure,Cardiology,May-13,,,,"For the treated lesion, indicate the maximum stent/balloon deploy pressure (atm)",,Numeric,3 characters,,,NCVD-PCI
measurement_of_duration,Measurement of Duration,"Hospital Discharge, Pharmacy",Sep-12,,,Unit ukuran tempoh preskripsi,Duration of medication in unit of measure,,Alphanumeric,5 characters,,Refer to lookup table Measurement of Duration,"PhIS, MoH"
,Meconium Aspiration Syndrome,"MNNR, NOR",May-13,,,,"1. Presence of meconium stained amniotic fluid at birth 2. Respiratory distress with onset within 1 hour of birth 3. Abnormal -CXR compatible with meconium aspiration 4. Absence of culture proven early onset bacterial sepsis or pneumonia 5. A PaO2<50mmHg in room air, central cyanosis in room air or a requirement for supplemental oxygen to maintain a PaO2 >50mmHg",,Alphanumeric,3 characters,Select from a shortlist,"01 = Yes, 02 = No",
,Medical Alert/Co-existing Condition,Hospital Discharge,Dec-05,Apr-12,,Awasan perubatan /ujud bersama keadaan,Conditions of clinical significant that exist or coexist that requires alert in patient management,,Alphanumeric,200 characters,,Refer to ICD-10,WHO International Classification of Diseases and Health Related Problems 10th Revision (ICD 10)
medical_complications_within_7_postoperativedays_colorectal_cancer,Medical Complications within 7 Post Operative Days in Colorectal,Colorectal Cancer,May-13,,,Komplikasi perubatan dalam masa 7 hari dari pembedahan pesakit kanser kolorektal,Medical complications that occurred within 7 days post op in colorectal cancer,,Alphanumeric,,,Refer to lookup table Medical Complications within 7 Post Operative Days in Colorectal Cancer,
medical_history_colorectal_cancer,Medical History of Colorectal Cancer,Colorectal Cancer,,,,Sejarah penyakit yang berkaitan pesakit yang mengidap kolorektal kanser,Illness that exist or coexist in patient with colorectal cancer,Numeric,,,Refer Lookup table of Medical history of Colorectal Cancer,,
,Medical Leave – Certificate Number,Hospital Discharge,Dec-05,,,Cuti sakit – nombor sijil,Serial number of the medical leave book,,Alphanumeric,10 characters,,,
,Medical Leave – Duration,Hospital Discharge,Dec-05,,,Cuti sakit – tempoh,Length in days,,Numeric,3 characters,,,
,Medical Leave – End Date,Hospital Discharge,Dec-05,,,Cuti sakit – tarikh akhir,Date ended,,Date - DD/MM/YYYY,8 characters,,,
,Medical Leave – Start Date,Hospital Discharge,Dec-05,,,Cuti sakit – tarikh mula,Date commenced,,Date - DD/MM/YYYY,8 characters,,,
,Medical Problem/History,"Obstetric, Neonatology, NOR",,,Maternal diseases,,Pre-existing condition and /or illnesses occurring during current pregnancy that potentially affect current pregnancy,Numeric,,,,,
,Medical Record Number,"Hospital Discharge, Forensic",Sep-12,,MRN,Nombor rekod pesakit,Unique number to identify the medical record document in health care facility providing care to the patient,,Alphanumeric,12 characters,,,
,Medication Name,Hospital Discharge,Dec-05,Apr-12,Name of drug,Nama ubat,Name of medication,,Alphanumeric,30 characters,,Refer Malaysian Drug Code (MDC),MoH
medicolegal_cases,Medico-legal Cases,Transplant,May-13,,,,Cases as defined under Section 328 of the Malaysian Criminal Procedure Code,,Alphanumeric,,,Refer to lookup table Medico-legal Cases,
,Medico-legal Specimen,Forensic,Sep-12,,,Spesimen Mediko-legal,All samples/items collected from live person or dead body for the purpose of medico-legal/police investigation,,Alphanumeric,50 characters,,,
,Medina Classification,Cardiology,May-13,,,,"It involves assigning a binary value (1,0) to each of the three components of a bifurcation (proximal region of main branch, distal region of main branch, and the side branch) depending whether there is more than (1) or less than (0) fifty percent lesion stenosis. If only proximal segment of the main branch (1) has a significant lesion, it becomes Medina 1, 0, 0. It distal segment of main branch alone is involved, it becomes 0, 1, and 0. Sole involvement of side branch is designated 0, 0, 1 and involvement of all the three is designated 1, 1, 1 and so on",,Numeric,1 character,"Binary (0, 1)",,NCVD-PCI
method_respiratory_diagnosis,Method of Respiratory Diagnosis,Respiratory,May-13,,,Kaedah diagnosa respiratori,The way the diagnosis of respiratory was made,,Alphanumeric,,Select from a shortlist,Refer to lookup table Method of Respiratory Diagnosis,
,Missing Permanent Teeth (M),Oral Health,Sep-12,Sep-12,Permanent teeth extracted,Gigi kekal yang telah dicabut,Number of teeth extracted,,Alphanumeric,2 characters,,Refer lookup table Missing Permanent Teeth,MoH
,MMC/MDC Registration Number,Hospital Discharge,Apr-12,,Reporter’s medical registration number,Nombor pendaftaran pelapor,MMC/MDC registration number,,Numeric,6 characters,,,MoH (MMC/MDC)
mmrc,MMRC,Respiratory,May-13,,,,Modified Medical Research Council Dyspnoea grading system,,Alphanumeric,,Select from a shortlist,Refer to lookup table MMRC,
mode_of_arrival,Mode of Arrival,Emergency,Oct-06,Apr-12,,Jenis ketibaan,Denotes the transport manner in which the patient arrived at Emergency Department,,Alphanumeric,30 characters,,Refer to lookup table Mode of Arrival,MoH
mode_of_delivery,Mode of Delivery,"Obstetric, MNNR, NOR",Oct-06,Apr-12,,Cara bersalin,Denotes the type of delivery conducted,,Alphanumeric,,,Refer to lookup table Mode of Delivery,NOR
mode_of_detection_colorectal_cancer,Mode of Detection of Colorectal Cancer,Colorectal Cancer,May-13,,,Cara pengesanan kanser kolorektal,Methods employed in disease detection,,Alphanumeric,,,Refer to lookup table Mode of Detection of Colorectal Cancer,
,Modified Rankin Scale,Neurology,May-13,,,,"A record of the functional outcome after an event based upon the extent of any disability or disabling symptoms experienced by the patient following the event, measured using the Modified Rankin Score tool",,Alphanumeric,,,,
morphology,Morphology,"Cancer, Nuclear Medicine",,Apr-12,Histology of primary cancer,Histologi kanser asal,Describe the histopathology of the tumour,,Alphanumeric,80 characters,,Refer Lookup Table,ICD-O ver 3
,Mother Status,NOR,May-13,,,,Condition of mother after delivery whether alive or dead,,,,,,NOR
,Multiple Pregnancy,NOR,May-13,,,,"Is a pregnancy of more than one fetuses such as two (twin), three (triplet), four (quintuplet) or more in a single pregnancy",,,,,,NOR
,Multiplicity,"Obstetric, Neonatology, MNNR, NOR",Apr-12,,,,"To indicate a singleton, twin, triplet or others i.e. quadruplets, etc",,Alphanumeric,,,"Singleton, Twin (TW1, TW2), Triplets (TR1,TR2,TR3), Others",MNNR
n_pathology_staging_colorectal_cancer,N Pathology Staging in Colorectal Cancer,Colorectal Cancer,May-13,,,Pengelasan patologi N dalam kanser kolorektal,The nodal involvement in the pathology of colorectal cancer,,Alphanumeric,,,Refer to lookup table N pathology staging in colorectal cancer,
,Name of Hospital,Cardiology,May-13,,,,Name of hospital where the patient was transferred to,,Alphanumeric,,Type in,,NCVD-ACS NCVD-PCI
,Name of Institution,Dermatology,May-13,,,,Name of hospital where patient receive treatment,,Alphanumeric,100 characters,,,
name_of_protocol_regiment_colorectal_cancer,Name of Protocol/Regiment in Colorectal Cancer,Colorectal Cancer,May-13,,,Nama protokol/regimen dalam kanser kolorektal,The regime of chemotherapy used in colorectal cancer,,Alphanumeric,,,Refer to lookup table Name of Protocol/Regiment in Colorectal Cancer,
,National Essential Drug List (NEDL),Pharmacy,Sep-12,,,Senarai ubat perlu kebangsaan,Whether drug is categorised as NEDL,,Alphanumeric,3 characters,Select from a shortlist,"01 = Yes, 02 = No",PhIS
nationality,Nationality,"Person Record, Cancer, Nuclear Medicine, Forensic, Mental",Mar-03,Apr-12,,Kewarganegaraan,Nationality as per stated in the legal document,,Alphanumeric,45 characters,,Refer to lookup table Nationality,
